Time,Date,ID,Q24,Q26,Q27,Q28,Q29_1,Q54,Q58,Q59,Q60,Q61_1,Q47,Q41,Q1,Q1_3_TEXT,Q2,Q3,Q34,,,Summary  General ,summarize The Fire Chief,Comprehensibility,Describe two stories seemed similar.,The two stories are similar,Summary  General ,summarize The Fire Chief,Comprehensibility,Describe two stories seemed similar.,The two stories are similar,Radiation.WO.Hint,Radiation.W.Hint,Gender,Gender.Other,Race,Age,Feedback536,12/5/18 15:58,R_1MXQaUyv7Ea1xVS,"There was a dictator in another land. However, a rebel wanted to capture the dictator's fortress. He seemed confident that he could do so with his army. However, when he got to the fortress he realized that there were mines along the way to the fortress. So instead of bringing his mass army together, he organized smaller groups in order to meet up near the fortress so the mines would set off. After that, he successfully took the dictator's fortress.","Mr. Johnson's shed was burning and the townspeople were panicking. They each tried to stop the fire with a bucket of water, but each time someone threw water at the fire, it would just come back. Nothing seem to be working. The fire chief at some point came by and organized everyone together. He told everyone to get a bucket of water and wait in a circle around the shed until everyone was there. Then, he ordered everyone to throw their bucket of water and the fire went out. In the end, they ended up promoting the fire chief.",Intermediate,They were both about ways that force can be used when there is some sort of obstacle of using all of the force directly.,Moderately Agree,,,,,,"I would gauge the nature of the tumor and see exactly what the situation. Afterwards, I would calibrate the x-ray in order to get rid of the tumor while not hurting any healthy tissue if at all possible.","I would see how much of the tumor needs to be destroyed in order to completely get rid of it. Afterwards, I would devise a plan in order to make smaller pulses or x-rays that eventually get rid of the tumor.",Male,,Non-Hispanic White or Euro-American,25 - 34,Thank you for giving me the opportunity to participate in this study.410,12/5/18 15:59,R_3P4sTveItkjI73Y," The fire seemed to evaporate each bucket of water before it hit the wood. It looked like the house was doomed. Just then the fire chief arrived. He immediately took charge and organized everyone.the dictator needed to move his troops and workers to and from the fortress. However, any large force would detonate the mines. Not only would this blow up the road, but it would also destroy many neighboring villages","The fire seemed to evaporate each bucket of water before it hit the wood. It looked like the house was doomed. Just then the fire chief arrived. He immediately took charge and organized everyone. He had everyone fill their bucket and then wait in a circle surrounding the burning shed. As soon as the last man was prepared, the chief gave a shout and everyone threw their bucket of water at the tire.",Good," The force of all the water together dampened the fire right down, and it was quickly brought under control",Agree,,,,,,"A system of representation for analogy must be able to describe afundamental property of such relational systems, namely, that analogy maybe defined at multiple levels of abstraction. For example, at a relatively lowlevel of abstraction the Attack-Dispersion story and the radiation problemhave a variety of corresponding"," the rays reach the tumor all at once at a sufficiently high intensity, the tumor will be destroyed. Unfortunately, at this intensity the healthy tissue that the rays pass through on the way to the tumor will also be destroyed. ",Female,,Non-Hispanic White or Euro-American,25 - 34,awesome survey 635,12/5/18 16:08,R_3p08lL2vFRSjlAG,,,,,,A general wanted to overthrow a dictator and had his men split into small groups to converge on the dictator. He had to split his men because the dictator rigged the roads to only let small groups pass.,The fire chief had people line up in a circle around a burning building and throw their bucket of water at the same time in order to put out the fire.,Good,Both required doing something at the same time and converging on a target to achieve the desired result. ,Agree,Lower intensity rays can be positioned to converge on the unhealthy tissue but positioned around it so that no two ray impacts healthy tissue.,The low rays can be positioned surrounding the unhealthy tissue so that the ray converges on the affected tissue but does not harm the healthy tissue.,Male,,Non-Hispanic White or Euro-American,25 - 34,1051,12/5/18 16:10,R_3Pn4SBQPPPD9k9c,,,,,,The general wanted to attack a fortress to overthrow an evil dictator. The fortress was surrounded by villages and the dictator had mined the roads so that no large group of men could pass over them without setting off the mines and destroying the villages. The general divided up his army and each small group of men used a separate road to arrive at the fortress; by making sure all the men arrived at the same time the general had a large enough force to defeat the dictator and destroy his fortress.,"Mr. Johnson's house caught on fire; he sounded an alarm and his neighbors came running; each with a bucket. Mr. Johnson lived by a lake, so there was plenty of water, but the individual buckets of water could not knock down the blaze. When the fire chief arrived, he organized the neighbors so that they all threw their buckets of water on the fire at once and were able to extinguish the blaze and save the house. The townspeople were happy with him and gave him a raise.",Good,The two stories both involved organizing groups of people to achieve a common goal.,Agree,"Send multiple rays of small amounts so that the outer tissue is not damaged but, because the rays all arrive at once, the tumor will be destroyed.",Set small amounts of rays that will not harm the outer tissue to arrive all at once so that the tumor is destroyed.,Male,,Non-Hispanic White or Euro-American,55 - 64,"All was good, thanks."641,12/5/18 16:14,R_2aCToCadMoriDkY,one night a fire out in  to wooden shed  full of timber on and the thiefe will enter the house to collect some things the fire seemed to evapourate of water the force of all water through  damped the fire right right now,one of the thiefe will enter to our house and he saw a some fire will evapourate in house and he should try to stop a fire with some water,Intermediate,they are similar to some fire and safety  situtation ,Moderately Disagree,,,,,,destory to turmor,some high intensity turmor problem and healthy issues,Male,,South Asian or Indian American,25 - 34,good447,12/5/18 16:30,R_3NK648bmIDOPoWz,"The general needed to invade a fortress in order to overthrow a dictator, but with a large army it would trigger the mine defense that the dictator had built around his fortress. So, in order to succeed the General decided to send many small forces to invade from different roads rather than send one large force and trigger the mines.",The Fire Chief in order to stop a fire basically organized citizens to circle around the fire and simultaneous dump their buckets of water onto the fire.,Good,In both stories it involved individuals or small groups of people working together to have have the same effect as one large cohesive group of people.,Agree,,,,,,"Perhaps small burst of high intensity rays, allowing the healthy tissue to recover, but gradually destroying the unhealthy tissue.","Small bursts of high intensity rays which would slowly destroy the tumor, but between each burst allowing the healthy tissue to recover.",Male,,"Black, Afro-Caribbean, or African American",25 - 34,545,12/5/18 16:37,R_30kF14vmRxnJS2u,,,,,,"There was a fortress in the middle of a small country ruled by a dictator. Many roads led to the fortress but there were small mines placed everywhere, which would go off only under extreme pressure (an assault). Someone decided to assault the fortress but did it in small groups in order to avoid the mines going off.",Fire started in a man's shed. People threw buckets of water on it but it wouldn't go out. Fire chief arrived and had everyone throw their buckets of water at once to extinguish the fire.,Good,"Not a lot of time was given to do this survey. Five minutes left and I'm moving at a fast pace. Anyways, they were similar because a clever solution had to come about to solve the problem. Something outside of the box.",Moderately Agree,How would I know? And in under 3 minutes? Sigh. A better procedure then the one described above. Chemo?,Maybe open up the stomach surgically then ray-gun that tumor.,Female,,Non-Hispanic White or Euro-American,35 - 44,Not enough time given to do this without stressing out. :)345,12/6/18 20:15,R_2ru4CYw3RdAnYmG,,,,,,A dictator ruled the surrounding country. He had a fortress in the middle of lots of farms and fields and villages. He lined the roads surrounding with mines to where a body could go across limited but many would detonate the mines killing and destroying all around them. A general rebel divised a plan that had all the men split up but arrive at the same time to take over the fortress.,A man's house was on fire. His house was luckily by a lake but all the neighbors that came to help only had small buckets. When they would throw a bucket on it didn't make a diference. They needed a lot of water all at once. So the fire chief decided to have everyone throw their buckets on all at once to quench the fire. It did and saved the man's house and so the fire chief got rewards.,Good,Either dividing and conquering or putting together small pieces to make a whole. It was logic and using pieces smartly.,Strongly Agree,So cut him open and expose the tumor and then put the guts backw hen it's gone?,You have to move the pieces around. Move the guts out of the way take care of it then put them back.,Female,,Non-Hispanic White or Euro-American,35 - 44,348,12/6/18 20:15,R_2QmH3FbGz0cPWSx,,,,,,The general wanted to capture a fortress and overthrow a dictator; the dictator placed mines around the road so the general split his army up to take multiple paths. The general and his army overthrew the dictator.,A fire broke out in a wood shed. The shed was near a lake and the fire chief had everyone fill a bucket up and throw it on the fire at the same time to get it under control. The fire chief got a raise.,Good,There was a clear leader in both stories and the leaders in both were successful in what they tried to do.,Moderately Agree,Splitting up the rays in a way that the concentration ends at the tumor itself and not at any healthy tissue.,The general story; splitting up the radiation so it all meets at one spot.,Male,,Non-Hispanic White or Euro-American,25 - 34,362,12/6/18 20:16,R_3wMxNRijWPUd36F,,,,,,"The general story pretty much talked about how the leader had to come up with a plan to get to the other dictators village to overtake. If the entire army marched, the mines that were planted would explode. To fix this, he split his army up into small groups so the mines would not detonate. The mines were designed to only go off when large armies march onto it. With this plan, the general was able to successfully overtake the village.","This story is basically about a fire fighter leader coming up with a plan to put out the fire of a burning house. He realized that he needed a plan to distinguish the fire efficiently, so he had everyone fill up a bucket of water and throw it on the fire all at once from different angles. This dampered the fire enough to save the building.",Intermediate,Both situations required critical thinking to solve the problem.,Agree,"I guess you could possibly make it a surgery and cut open the tissue before using the rays. This would allow you to not hit the tissue with the rays, and then just stitch it back up after you destroy the tumor.",I guess you could break the rays into very small beams so they would not harm the tissue?,Male,,"Black, Afro-Caribbean, or African American,Non-Hispanic White or Euro-American",18 - 24,Not at all. This was an interesting study!446,12/6/18 20:17,R_2VjCrGmZNsXaLa3,,,,,,The general was trying to defeat the dictator but there were many obstacles in his way. Eventually a new plan was made ,His shed was on fire but luckily his shed was near a lake. Unfortunately the citizens only had buckets but they threw water all at the same time and were able to extinguish the fire. After this he became the fire chief. ,Intermediate,I only saw that people had to work together and there were two official authorities. The dictator and a chief,Disagree,Radiation therapy ,"I'm not really sure but radiation therapy can help along with some drugs. It is difficult to solve this because my knowledge is limited in this field, plus this hit only has a 12 minute limit. ",Male,,Middle Eastern or Arab American,25 - 34,12 limit is too short to give a in depth response. 388,12/6/18 20:17,R_3rO1rEkRCi05sCI,"A general need to bypass traps, so he split up his troops to arrive at the same time, but safely. ","The fire chief had the people gather the water and wait to pour it all on at once, instead of small buckets at a time. ",Good,The moral of both stories was the same- that sometimes you need a new approach to a problem. Both stories involved looking at a problem in a new way. ,Agree,,,,,,"Point lower intensity rays at the tumor from multiple angles, so that they gather as one ray on the tumor. This saves the healthy tissue while destroying the tumor. ","Point multiple low intensity rays at the tumor from different angles, so they group on the tumor and destroy it but don't harm the healthy tissue. ",Female,,Non-Hispanic White or Euro-American,25 - 34,509,12/6/18 20:18,R_2axcQ9aXBZ52Pt5,"A large, organized distribution of small elements can overcome a much larger issue.",Teamwork works.,Good,"Joint, organized efforts will achieve success. ",Agree,,,,,,Align the rays at low intensity but allow them to intersect at a tumour where their joint power will the applied. ,"Using a smaller amount but in a joint, directed effort as in The Fire Chief.",Male,,Non-Hispanic White or Euro-American,35 - 44,507,12/6/18 20:18,R_3NZYd6db1fan0YV,,,,,,A rogue general wanted to overtake a fortress in the middle of the country surrounded by farms. Many roads led to this fortress and the general gathered an army to take the fortress. Just before proceeding the general learns that the roads are booby trapped to prevent large groups of people traveling on them at once. So he devises a plan to send small groups of soldiers towards the fortress on different roads. The plan succeeds and they are able to meet at and overtake the fortress.,"A shed next to a person's house catches on fire. The entire village wakes up to battle the fire. The are armed with small bucks. The shed happens to be near a lake. As soon as villagers pour their buckets of water on the fire, it is evaporated. They are making no progress in putting the fire out. The fire chief arrives and orders everyone to grab a bucket of water and surround the shed. They will pour their buckets at the same time. The strategy works and the fire is put out. The fire chief is voted a raise.",Good,there was a problem that a leader needed to solve. they both succeed and become heroes.,Strongly Agree,"multiple rays shining on the tumor for intense, but short periods of time.",gathering multiple lasers to attack the tumor from all sides at once.,Male,,"East Asian or Asian American,Non-Hispanic White or Euro-American,Other",35 - 44,446,12/6/18 20:18,R_1irpJK7qv6Ihi01,"There was a small country which has a fortress in the middle that had the dictator. Someone wanted to overthrow him and got a big army but the big army could not get through a minefield due to it exploding if there were too many troops. Because there were many roads to the fortress, the general split up the troops, didn't trigger the bombs and overthrew the dictator.",There was a wood shed on fire and a bunch of people with buckets were trying to douse it one by one but this didn't work. The chief arrived and got everyone to fill their buckets and throw the water on it at the same time to put out the fire.,Good,They both used the idea that a big problem can be solved by many small things or people.,Agree,,,,,,"Using many smaller lasers to target the tumor and build up the power, they could target it at the same time and not harm the surrounding tissue.",Smaller rays can be used together to get a high enough intensity to destroy the tumor and not harm the healthy tissue.,Male,,Non-Hispanic White or Euro-American,35 - 44,"No issues, short timer!"527,12/6/18 20:18,R_22kS7BcAh93bsdJ,"A general was needing to capture a fortress however, they_验d set mines around it. If too many people tried to pass they_验d go off. So he sent smaller groups on all different paths to avoid detonating them. They all arrived at the fortress the same time and took control",A man had a fire near his house. They needed to stop it before it spread to his home. He sounded the alarm and the neighbors came to help. They_验d have to have a lot of water put on it at once to put it out but they only had small buckets. The fire chief showed up and had everyone fill there buckets and throw it on at the same time to put it on,Good,The message to accomplish something big sometimes needs smaller parts,Agree,,,,,,To do smaller incriminates of treatments at the high dose,To use smaller treatments times to achieve the goal ,Female,,Non-Hispanic White or Euro-American,25 - 34,563,12/6/18 20:19,R_1ewmXgNQNq7ojD3,,,,,,The General had to find a way to get his people to the fortress to save the town from a dictator but the dictator placed mines in their way so they couldn't get through. The General overcame the obstacle and was able to save the people from the dictator.,"A man's barn was on fire and his house was at risk of catching on fire. The only water source was from a lake. The people were trying to put out the fire with small buckets of water. It wasn't working. When the fire chief arrived, he had them all fill up buckets and they threw the water on the fire at the same time. This put out the fire. The chief was given a raise.",Good,In both stories someone needed help.,Disagree,laser surgery,laser surgery,Female,,Non-Hispanic White or Euro-American,35 - 44,none456,12/6/18 20:19,R_325igVcziLlKMcY,,,,,,The general took down the unbeatable fortress by moving his men methodically over the land mines in small groups.,The fire chief conquered a shed on fire by employing everyone to simultaneously douse the fire with water from buckets thus saving a nearby house.,Good,The two situations were similar in that an organized and joint effort was required to beat an seemingly unbeatable challenge.,Moderately Agree,A steady increase to the rays might keep the patient safe while destroying the tumor slowly.,A slow and steady approach works best in these situations.,Female,,Non-Hispanic White or Euro-American,25 - 34,Too short of a timer594,12/6/18 20:19,R_1IYrN3XpV2QRt2e,,,,,,"A general wanted to overthrow a dictator who was in a central fortress. The roads to the fortress had mines that prevented the general's entire army from approaching all at once, so he had to split the troops up and have them come at the fortress down different roads to avoid having any group large enough to set off the mines. They met at the fortress and were able to secure victory.","Dude's shed caught on fire and it was pretty close to his house. His neighbors all showed up to help and there was a lake right there, so no trouble getting water. But bucket by bucket, the fire wasn't really being affected at all. The fire chief showed up and had everyone surround the shed with filled buckets, then all throw the water at the same time, thus enabling them to get the fire under control. He became known as the tire chief and got a raise.",Good,Both took an approach to a problem and split it up to come at the solution from multiple angles at the same time.,Moderately Agree,Set up an array of rays from around the tumor at different locations to bombard it from multiple angles at the same time with lower intensity. Hopefully that will still have the effect you want.,Previous solution. No time to retype it -- timer on HIT is too short!,Male,,Non-Hispanic White or Euro-American,35 - 44,You need a longer timer on this! I have a script to warn me when time is running out and it started clanging at me two screens ago. 597,12/6/18 20:19,R_ekQCnP5m9AY7WG5,,,,,,"A general wanted to rebel the fortress, the general was successful to capture the fortress and threw the dictator.","The fire broke on wood shed of Mr. Johnson, the fire chief helped to get the fire down.",Good,both the stories had issues which seemed impossible to solve then resolved.,Moderately Agree,no idea,The fire chief,Male,,South Asian or Indian American,25 - 34,no571,12/6/18 20:19,R_Y3o4aJ0TpGhtXs5,"A small country was ruled from a strong fortress by a dictator. The fortress was situated in the middle of the country, surrounded by farms and villages. Many roads led to the fortress through the countryside. A rebel general vowed to capture the fortress. The general knew that an attack by his entire army would capture the fortress. He gathered his army at the head of one of the roads, ready to launch a full-scale direct attack. However, the general then learned that the dictator had planted mines on each of the roads. However, any large force would detonate the mines. Not only would this blow up the road, but it would also destroy many neighboring villages. It therefore seemed impossible to capture the fortress.","One night a fire broke out in a wood shed full of timber on Mr. Johnson_验s place. As soon as he saw flames he sounded the alarm, and within minutes dozens of neighbors were on the scene armed with buckets. The shed was already burning fiercely, and everyone was afraid that if it wasn_验t controlled quickly the house would go up next.As soon as the last man was prepared, the chief gave a shout and everyone threw their bucket of water at the tire. The force of all the water together dampened the fire right down, and it was quickly brought under control, Mr. Johnson was relieved that his house was saved, and the village council voted the tire chief a raise in pay.",Good,unity is strength,Agree,,,,,,Qualified x rays,yes,Male,,South Asian or Indian American,25 - 34,good608,12/6/18 20:20,R_2vcUcyUOcKJZj0l,HE WANTED TO CAPTURE THE FORTRESS AND TAKE OVER THE DICTATOR. HE DIVIDED HIS ARMY INTO SMALLER GROUPS SO LANDMINES WOULDNT DETONATE. THEY OVERTHREW THE DICTATOR,THE SHED WAS ON FIRE BESIDE A LAKE SO THE FIREMEN ALL TOOK BUCKET AND THREW THE WATER ON THE SHED TO PUT IT OUT,Good,THEY ALL DIVIDED INTO SMALLER FRACTIONS TO GET A MAIN GOAL ACCOMPLISHED,Agree,,,,,,USING SEVERAL LASER AT A LOWER RATE,USING A LASER ON A SMALLER AREA OF THE TISSUE ,Female,,Non-Hispanic White or Euro-American,45 - 54,515,12/6/18 20:20,R_2RRg6fh436FG583,"A general wanted to capture a fortress and had a large army and knew it could capture the fortress but the other king of the fortress had mines set up everywhere, the general proceeded to split his large army up into smaller factions of men and was able to strike all at the same time for a successful attack, capturing the fortress. ","There was a wood shed next to a lake that caught on fire, people were relieved since there was so much water but were unable to put out the fire with small buckets of water so t he fire chief ordered everyone to get a bucket of water and line up around the wood shed, they all simultaneously threw water at the fire and were able to put it out. ",Good,They both applied the idea that sometimes if you cant apply the full force needed you can break it up into small forces that add up to the same thing and be successful. ,Agree,,,,,,Use a ray at medium level.,Use the same force in the ray but in small applications. ,Male,,Latino or Hispanic American,25 - 34,NO634,12/6/18 20:20,R_3LXrW3mglsoe7q7,"A small country was ruled from a strong fortress by a dictator.Many roads led to the fortress through the countryside. A rebel general vowed to capture the fortress. The general knew that an attack by his entire army would capture the fortress.the dictator had planted mines on each of the roads. The mines were set so that small bodies of men could pass over them safely, since the dictator needed to move his troops and workers to and from the fortress.He divided his army into small groups and dispatched each group to the head of a different road. When all was ready he gave the signal and each group marched down a different road.the general captured the fortress and overthrew the dictator.","One night a fire broke out in a wood shed full of timber on Mr. Johnson_验s place. As soon as he saw flames he sounded the alarm, and within minutes dozens of neighbors were on the scene armed with buckets.If a large volume of water could hit the fire at the same time, it would be extinguished. But with only small buckets to work with, it was hard to make any headway.He immediately took charge and organized everyone. He had everyone fill their bucket and then wait in a circle surrounding the burning shed. As soon as the last man was prepared, the chief gave a shout and everyone threw their bucket of water at the tire. Mr. Johnson was relieved that his house was saved, and the village council voted the tire chief a raise in pay.",Good,SOME DIFFERENT BETWEEN THESE TWO STORIES,Moderately Disagree,,,,,,LOWR INTENSITIES RAY USED FOR DESTROYED TUMOR,THE SOLUTION DOES NOT DEPENDS ON THESE TWO STORIES SIMPLY FOR MAKING HUMAN HEALTH DEPENDS UPON USED FOR  LOW INTENSITIES FOR DESTROY TUMOR,Male,,South Asian or Indian American,25 - 34,GOOD STUDY