Time,Date,ID,Q24,Q26,Q27,Q28,Q29_1,Q54,Q58,Q59,Q60,Q61_1,Q47,Q41,Q1,Q1_3_TEXT,Q2,Q3,Q34425,12/6/18 21:07,R_OlBFN3ZRbdJPTUt,"A small country was ruled from a strong fortress by a dictator. The fortress was situated in the middle of the country, surrounded by farms and villages. Many roads led to the fortress through the countryside. A rebel general vowed to capture the fortress. The general knew that an attack by his entire army would capture the fortress. He gathered his army at the head of one of the roads, ready to launch a full-scale direct attack. However, the general then learned that the dictator had planted mines on each of the roads. The mines were set so that small bodies of men could pass over them safely, since the dictator needed to move his troops and workers to and from the fortress. However, any large force would detonate the mines. Not only would this blow up the road, but it would also destroy many neighboring villages. It therefore seemed impossible to capture the fortress. However, the general devised a simple plan. He divided his army into small groups and dispatched each group to the head of a different road. When all was ready he gave the signal and each group marched down a different road. Each group continued down its road to the fortress so that the entire army arrived together at the fortress at the same time. In this way, the general captured the fortress and overthrew the dictator.The general attributed his success to an important principle: If you need a large force to accomplish some purpose, but are prevented from applying such a force directly, many smaller forces appliedsimultaneously from different directions may work just as well.","One night a fire broke out in a wood shed full of timber on Mr. Johnson_验s place. As soon as he saw flames he sounded the alarm, and within minutes dozens of neighbors were on the scene armed with buckets. The shed was already burning fiercely, and everyone was afraid that if it wasn_验t controlled quickly the house would go up next. Fortunately, the shed was right beside a lake, so there was plenty of water available. If a large volume of water could hit the fire at the same time, it would be extinguished. But with only small buckets to work with, it was hard to make any headway. The fire seemed to evaporate each bucket of water before it hit the wood. It looked like the house was doomed. Just then the fire chief arrived. He immediately took charge and organized everyone. He had everyone fill their bucket and then wait in a circle surrounding the burning shed. As soon as the last man was prepared, the chief gave a shout and everyone threw their bucket of water at the tire. The force of all the water together dampened the fire right down, and it was quickly brought under control, Mr. Johnson was relieved that his house was saved, and the village council voted the tire chief a raise in pay. The fire chief attributed his success to an important principle: If you need a large force to accomplish some purpose, but are prevented from applying such a force directly, many smaller forces applied simultaneously from different directions may work just as well.",Good,not similar,Agree,,,,,,"I recently came across some old-ish work in analogical reasoning that tickled my brain about priming during experiments. What concerns me is the quality of conclusions reached by the research and how we might improve our experimental methods in studying analogical reasoning, especially as it pertains to design. References are at the end of this post.","Goswami & Brown reasoned that children might fail Piaget's tasks because they lack knowledge of the relations entailed. On this view, children ought to be able to solve classical analogy problems provided the analogies are based on familiar relations.The task: children were presented with a horizontal array of 3 pictures (the a, b, and c) terms and were given 5 pictures from which to chose one to complete the sequence.",Male,,South Asian or Indian American,25 - 34,very helpful this survey 268,12/6/18 21:15,R_D5AsFLXFCyi9SsF,,,,,,"summary, like paraphrase, allows you to reproduce another writer's thoughts_延but inshortened form. In writing a summary, you focus on the most important statements ofthe original statements of the original passage and eliminate the less importantmaterial. Three techniques_延selection and deletion, note taking, and miniaturizing_延can help youshorten the material. As you become more adept at summarizing, you will devise your owncombination of these techniques for each occasion. But in all cases the summary must be writtenin readable prose that reflects the essential meaning of the original text. Like paraphrase,summary can be used for many purposes: to help you understand the main points and structureof the author's argument, to convey understanding to others, to present background informationquickly, or to refer to another writer's ideas in the course of making your own original statement","Retired Fire Chief pens reflections on his life as a volunteer firefighter. _岩Fire Chief_ by Ed Daniels shares experiences and sacrifices until now known only to the volunteers themselves. In his first novel, _岩Fire Chief; The Story of a Volunteer Firefighter,_ author Ed Daniels recalls his life as a volunteer firefighter in the mountains of Colorado. Based on actual events, the book takes readers into the heat which countless volunteer firefighters face every day throughout the world. Most people don_验t realize that the majority of the firefighters, EMTs and Paramedics who respond to fires and accidents in rural areas are volunteers. These First Responders sacrifice time with their families and their careers, responding at a moment_验s notice to protect the lives and property of those who need them. While he fictionalizes his characters and locations, _岩Fire Chief_ describes Daniels_验 actual experiences and encounters in frightening detail. He relates stories of house fires, wildfires, car accidents and back country rescues as they really happened. We gain insight into what was going through his mind, his emotions and his reactions as he responded to horrific incidents sometimes involving family and friends. Woven throughout his emergency encounters, Daniels describes what it is like for a volunteer fire chief trying to balance the load of raising a family, handling a career, and leading a team of sometimes unruly volunteers. Readers go along for the journey as he grows into an expert leader who eventually retires, and reflects on his lifetime of bravery and public service. Daniels said. _岩I want others to be inspired to volunteer and to see for themselves what life is like as a First Responder. People should have a better understanding of what their neighbors and friends are experiencing as volunteer firefighters, EMTs and Paramedics._",Good,"We used to sing it together at a karaoke bar called Same Same But Different during our J1 summer in New York, her on lead vocals, me on backing. We_验d mock fight over which of us could have Luke Goss, the one we had decided was the better looking of the identical twins in Bros. But I knew if the unlikely situation did arise, Molly would get Luke and I_验d have to settle for his slightly less handsome brother Matt. She loved that song, she was the one who wanted to be famous. In the end, she had her picture splashed across the newspapers for the worst possible reason. _岩Tragic twin_ they called her.",Agree,"I recently came across some old-ish work in analogical reasoning that tickled my brain about priming during experiments. What concerns me is the quality of conclusions reached by the research and how we might improve our experimental methods in studying analogical reasoning, especially as it pertains to design. References are at the end of this post.Bear with me; we need to set things up first.In a 1945 paper, Duncker offered the following scenario.Suppose you are a doctor faced with a patient who has a malignant tumor in his stomach. It is impossible to operate on the patient, but unless the tumor is destroyed, the patient will die. There is a kind of ray that can be used to destroy the tumor. If the rays reach the tumor all at once at a sufficiently high intensity, ","I recently came across some old-ish work in analogical reasoning that tickled my brain about priming during experiments. What concerns me is the quality of conclusions reached by the research and how we might improve our experimental methods in studying analogical reasoning, especially as it pertains to design. References are at the end of this post.Bear with me; we need to set things up first.In a 1945 paper, Duncker offered the following scenario.Suppose you are a doctor faced with a patient who has a malignant tumor in his stomach. It is impossible to operate on the patient, but unless the tumor is destroyed, the patient will die. There is a kind of ray that can be used to destroy the tumor. If the rays reach the tumor all at once at a sufficiently high intensity, ",Male,,South Asian or Indian American,25 - 34,good. i was very  interest to the survay1418,12/6/18 21:30,R_2YFjBS57Mdofui7,,,,,,There was a fortress in the center of a country which was ruled by a dictator. A rebellious general decided that he wanted to take over the fortress. He gathered an army together to try to attack and capture it. The general then found out that the fortress was surrounded by mines on every road connected to it. The mines would detonate if any large amount of force passed over them so the general decided to send his men in small groups on every road. The fortress was successfully captured and the dictator was overthrown.,"There was a shed on fire that was full of wood at a man's home. Many neighbors came rushing over to help put the fire out so that the man's home wouldn't catch on fire. The fire was so intense that every small bucket full was not enough. There was a lake nearby which had plenty of water. The fire chief shortly arrived and had everyone grab a small bucket of water and throw it on the fire at the same time. This strategy worked and the fire was put out, saving the man's home. The fire chief was given a raise.",Good,The stories were similar because there were two strategies used that solved a problem. The first one required small groups of people going over the mines at the same time while the second required everyone throw a small bucket of water on a fire.,Agree,The type of procedure that could be used to destroy the tumor with rays and also avoid destroying healthy tissue would be to use the rays separately on certain parts of the tumor at different times.,The best procedure would be to use the high intensity rays on different parts of the tumor instead of all at once.,Female,,Non-Hispanic White or Euro-American,25 - 34,The only issue I had was that there wasn't enough time to complete this survey before the timer expired on the HIT page.691,12/6/18 22:04,R_3NPUuc1InAkqrcP,,,,,,A general realized that to attack he must divide his army so that a small portion traveled over each road to avoid tripping the mines present.  The Army then combined at the place of attack after arriving at the same time.,A fire could not be fought by the people with buckets because each bucket was evaporated by the fire before it could reach it.  The fire chief arrived and realized that if everyone filled their buckets and then threw them on the fire at the same time the fire would be overcome.,Good,They each talked about how divided forces could be used and then reunited at the end to successfully over obstacles.,Strongly Agree,I would combine many smaller rays of lesser power that would harmlessly pass through normal tissue before converging at the tumor to destroy it.,Use many rays of lesser power that pass harmlessly through normal tissue before converging at the tumor and combining to destroy it.,Male,,Non-Hispanic White or Euro-American,55 - 64,no issues534,12/6/18 22:13,R_2y3MnMvX6yV4ugq,"A small country was ruled from a strong fortress by a dictator. The fortress was situated in the middle of the country, surrounded by farms and villages. Many roads led to the fortress through the countryside. A rebel general vowed to capture the fortress. The general knew that an attack by his entire army would capture the fortress. "," Sofa Super Store Fire presentation wasn_验t delivered by an outsider it was presented by one of the CFD_验s own, a firefighter who has experienced the events first-hand.",Good,the general devised a simple plan,Moderately Agree,,,,,," a doctor faced with a patient who has a malignant tumor in his stomach. It is impossible to operate on the patient, but unless the tumor is destroyed the patient will die.","a kind of ray that can be used to destroy the tumor. If the rays reach the tumor all at once at a sufficiently high intensity, the tumor will be destroyed.",Male,,South Asian or Indian American,35 - 44,good789,12/7/18 9:09,R_331CoUpxKYeoljR,,,,,,"The General had vowed to take over the fortress of the Dictator.  He gathered his army at the top of one of the roads into the city.  He learned that there were mines all throughout the roads, that would allow small groups of people to pass over without going off, but larger groups would set them off.  The general broke his army into smaller groups, sent each group over a different road, and they all met in the middle at the fortress to overthrow it. ","A man's shed was on fire, he sounded the alarm, the citizens all ran with their buckets to try and keep the fire from spreading to the man's house.  They were running back and forth to the lake, trying to contain the fire, but it wasn't working.  Then the fire chief showed up and direct them all to fill their buckets, make a circle, and throw their water at the same time.  This was enough to put the fire out.  The village voted on give the fire chief a raise.  ",Good,"There was a male who was in charge of a situation, he had to think strategically, he solved a problem",Moderately Disagree,"I have no idea.  I'm not a doctor.  Is there some kind of procedure that can target the tumor and not the tissue?  Could they open the patient up, move muscles/tissues/organs around the tumor and then target the tumor?  ","Small bits of the ray being shot at the tumor from different angles that would leave the tissues around it unharmed, but if all the rays met at the tumor at the same time, it would effect the tumor in a major way.  Ahhhhh I see what you did there! ",Female,,Non-Hispanic White or Euro-American,25 - 34,"Not unclear, it took me a a min to get to the solution I think you were looking for, but I got there eventually! "610,12/7/18 9:12,R_1hEXBDOnSgMeveW,The fortress was protected by mines at each individual entrance that would only detonate by heavy force so the attack plan was altered so that small forces would each attack at a separate entrance rather than all together as a single force thus not tripping the mines. ,The fire chief story was similar in that the solution was to have all individuals release their water at the same time from different locations to extinguish the fire.,Good,The stories were similar in that a strategy needed to be employed to utilize the resources available as individuals or small groups. ,Agree,,,,,,several small rays from different angles all focused on the target so that each one individually isn't strong enough to damage the tissue along its path,Aim several smaller rays from different angles on the target - same solution as previously stated,Female,,Non-Hispanic White or Euro-American,55 - 64,nothing more to say317,12/7/18 9:24,R_tSedVPPQfagYdvb,,,,,,"The general wanted to capture a fortress, but the dictator had placed mines that only detonated when a large force crossed over them. So to go ahead with his attack he divided his army into smaller groups that all met at once once they cleared the minefield.",Mr Johnson had a house fire. He sounded an alarm and all the people quickly came with buckets to put out the fire. They threw all their water at once instead of separetly so that the force would stop the fire.,Good,They were similar because they were about small parts becoming one whole and how there is strength in unification,Agree,Use even more weaker rays that don't damage the skin but add up to a powerful amount that will destroy the tumor.,Use lighter rays but more of them that add up to the same strength.,Male,,Non-Hispanic White or Euro-American,25 - 34,339,12/7/18 9:25,R_10YrGnHLYkyfA3r,,,,,,"An overview of content that provides a reader with the overarching theme, but does not expand on specific details. A summary describes a larger work (such as an entire book, speech, or research project), and should include noticeably less content then the original work. Summaries can save a reader time because it prevents the reader from having to actually go through and filter the important information from the unimportant. ""Ben was able to review the well-written summary provided by his peer, instead of re-reading the entire textbook, and as a result he still received an A on his mid-term.""",".The past six weeks have seen two sworn employees of the Austin Fire Department suspended 60 days for drinking and driving. In an odd twist, in both cases the firefighters were arrested while purchasing food at fast-food restaurants....""",Good,two stories are very similar to the each person ,Agree,yes destroying the tissues,destroying the tissues,Male,,South Asian or Indian American,25 - 34,very intresting 281,12/7/18 9:25,R_10UgRjiHNk5COSI,A dude wanted to take a fort and got a bunch of people to help.,A guy wanted to fight a fire and got a lot of people to help.,Good,They were both about how a large problem can be solved by several small things working together.,Moderately Agree,,,,,,A focused gene therapy might be best.,Perhaps many smaller treatments would work.,Male,,Non-Hispanic White or Euro-American,35 - 44,356,12/7/18 9:26,R_u2F2RIC1u994Mq5,,,,,,"The however, the general devised a simple plan. He divided his army into small groups and dispatched each group to the head of a different road. When all was ready he gave the signal and each group marched down a different road.","Each group continued down its road to the fortress so that the entire army arrived together at the fortress at the same time. In this way, the general captured the fortress and overthrew the dictator.",Intermediate,not maching for the storie my life ,Moderately Agree,the It is impossible ,It is impossible ,Male,,South Asian or Indian American,25 - 34,none369,12/7/18 9:27,R_1kFatlK5RtVs2WF,Pretty much if everyone works together at the same time it's a lot better and more effective than if a lot of people do it at different times.,"everyone was trying to put out the fire put the water seemed to evaporate but when everyone worked together and threw on water at the same time it worked",Good,If you work together it works better than separately,Strongly Agree,,,,,,Have to have high and wing it,get a lot of low frequency and work together to make high,Female,,Non-Hispanic White or Euro-American,25 - 34,450,12/7/18 9:27,R_1QmZLetYr5Kj6vb,"The general wanted to attack a fortress. To do so, he needed to send his army down certain roads that led to the fortress. However, the roads were mined, and any large force would trigger the mines and the roads would be destroyed, and his forces and many neighboring villages would be destroyed. So, he decided to split his men up into smaller groups and send each group down a different road, so they wouldn't trip the mines. They timed their arrivals so they all arrived at the fortress at the same time.","A man's shed was on fire, and it was going to spread to his house soon. Fortunately his shed was next to a lake. They only had small buckets to work with, and each one alone wasn't enough to put out the fire. The fire chief organized everybody and had them fill their buckets and wait in a circle around the shed. When everybody had filled their buckets, they all poured the water on at once and the fire was put out. The fire chief was later given a raise.",Good,They both involved characters who solved their problems by applying a number of small forces to create a bigger force.,Strongly Agree,,,,,,Adjust which part of the body the rays enter through so there is minimal healthy tissue between the ray and the tumor.,"Using this logic, you would use multiple smaller rays instead of one large ray, and aim them all around any healthy tissue.",Male,,Non-Hispanic White or Euro-American,25 - 34,"Nothing, thank you."390,12/7/18 9:27,R_1HoDCytQ2ntOwIC,,,,,, strong fortress by a dictator.. Many roads led to the fortress through the countryside,One night a fire broke out in a wood shed full of timber on Mr. Johnson潴s place,Good,the stories are different,Moderately Agree,"At lower intensities, the rays are harmless to healthy tissue, but they will not affect the tumor, either. What type of procedure might be used to destroy the tumor with the rays and at the same time avoid destroying the healthy tissue","The Tumor and the Fortress The fact that people can impose coherent interpretations on messy, ambiguous  What type of procedure might be used to destroy the tumor with the rays and at the same time avoid destroying the healthy tissue",Male,,Non-Hispanic White or Euro-American,25 - 34,all clear no confusing304,12/7/18 9:27,R_3016a0y4y6jA1AL,,,,,,The General broke his troops down to smaller groups in order to fool the mines in the road. This way he was able to safely get his men to the fortress.,"The Fire Chief made everyone grab buckets of water and splash them at the fire at the same time, because alone the water made no difference, but together is was substantial enough to put it out.",Good,"There was an element of innovation.  They both had a leader who took charge, and although the first story they broke apart and the second they came together, it was still similar in that they worked together through the problem.",Moderately Agree,One that is very pinpointed and targeted only at tumor.,"Perhaps, dividing up the tumor area and only a little bit of ray on a little bit of tumor such as dividing up ""The General.""",Female,,Non-Hispanic White or Euro-American,35 - 44,Not unclear.477,12/7/18 9:27,R_3MukVSPCEEVF0V8,,,,,,"The general wanted to attack a fortress, but the dictator who lived there had placed mines on all the roads leading to the fortress. If the general attacked with a full army, it would set off the mines. So, he split his army into groups and had each group use a different road. Split the army was light enough to avoid setting the mines off, and they all arrived safely at the fortress. ","There was a fire in a town, but there were only small buckets to use, and the water seemed to evaporate by the time the next bucket was ready. The fire chief arrived and made everyone circle the fire with full buckets. He gave an order and everyone threw their water on at once, putting the fire out.",Good,They both involved unorthodox approaches to a problem that would otherwise make the desired outcome impossible. ,Agree,"I'm honestly not sure. This seems like the kind of situation where some damage is going to be caused either way. If you can't operate, then the tissue in front of the tumor will be destroyed. ","Maybe you could use several different beams? I don't think that would work though, as they'd all have to be set to the lower intensity to avoid damaging the healthy tissue, and the story already told me that the lower intensity won't affect the tumor.",Male,,Non-Hispanic White or Euro-American,25 - 34,486,12/7/18 9:28,R_22KD790hIMGl3j8,"A small country was ruled from a strong fortress by a dictator ,The general knew that an attack by his entire army would capture the fortress,any large force would detonate the mines,the general captured the fortress and overthrew the dictator.",fire protection district,Intermediate, dispatched each group to the head of a different road,Agree,,,,,,There is a kind of ray that can be used to destroy the tumor. , high intensity,Female,,South Asian or Indian American,18 - 24,496,12/7/18 9:28,R_1f74fIGMNmAwJaS,"The general needed to attack a fortress with his large army, but the roads to it were mined. However, small forces could get over the mines, so he split his army into many small groups to converge on the fortress and take it over.","A house was on a fire near a lake. A bucket brigade could not put the fire out, but a fire chief came and had everyone fill his or her bucket, then they three it on the fire all at once, putting the fire out.",Good,Sometimes many small forces are better than one large one.,Agree,,,,,,"Use multiple, less intense x-rays that converge on the tumor.",Using multiple lower intensity x-rays that converge on the tumor without destroying the healthy tissue.,Male,,Non-Hispanic White or Euro-American,35 - 44,506,12/7/18 9:28,R_3nUxStimUx4Dowe,,,,,,the fortress was not easy to acheive they made a strategy to attack on it and devide there people in many groups to attack on same time.,"fire cheif saved a house from fire by taking the right decision on time by givivng a trick to people that throw water at same time, and it worked. people appreciated him and approached for his increment.",Intermediate,there were strategies in both stories to acheive the target.,Moderately Agree,a moderate intensity of rays should be use so that tumor can kill with minimum health issues.,the knife to cut down the tumour instead of rays.,Male,,South Asian or Indian American,35 - 44,thanks