Time,Date,ID,Q24,Q26,Q27,Q28,Q29_1,Q54,Q58,Q59,Q60,Q61_1,Q47,Q41,Q1,Q1_3_TEXT,Q2,Q3,Q34406,12/7/18 9:40,R_p0Jg3PEELssndN7,"We want to find great ways to engage people on important topics, like reducing food waste and carbon emissions, using smart technologies, in a fun and interactive way","A firefighter who is head of their department is called a fire chief. They generally oversee and manage their firefighting team. This position necessitates years of satisfactory experience, additional fire training, and usually college coursework, as this job is received by promotion.",Intermediate,"Preparation means you潴ll be more confident, less fearful of the unknown and much less likely to suffer from interview nerves.",Agree,,,,,,"Radiation oncologists use this type of treatment to destroy cancer cells and slow tumor growth without harming nearby healthy tissue. ... When it is not possible to destroy all of the cancer, doctors may use radiation therapy to shrink tumors and relieve symptoms. This is called palliative radiation therapy.","Radiation oncologists use this type of treatment to destroy cancer cells and slow tumor growth without harming nearby healthy tissue. ... When it is not possible to destroy all of the cancer, doctors may use radiation therapy to shrink tumors and relieve symptoms. This is called palliative radiation therapy.",Male,,South Asian or Indian American,25 - 34,A previous question asked 'Which dialects of English consider 潴would潴 to be a polite form of 潴will潴?' I'd say it's a virtually universal pragmatic device to use 'would' where 'will' would appear the logical choice (though there are probably some situations where using it might be confusing).1167,12/7/18 9:40,R_cUARX2hnb2EVm5r,,,,,,The general wanted to overthrew the dictator. He divided his troops into small groups so that it can avoid the mines. They successfully reached the fortress of the dictator on same time and defeated the dictator.,Mr.Johnson's wood house was under fire. Neighbors gathered and tried to put off the fire with small buckets. But it failed. Then fireman arrived and he arranged them in a circle and asked to pour the water at same time. This turned off the fire. ,Intermediate,There was obstacles. An idea changed the situation.,Moderately Agree,Use lower intensity rays for long time so that tumor may destroyed slowly.,Apply several low intensity rays same time.,Male,,Other,25 - 34,"The time 12 minute is not enough. If you want good result , give enough time.I could not complete in 12 minute. So I had to submit the hit with my mturk ID. "477,12/7/18 9:41,R_24eZXaablF5khMJ,"A general wanted to take over a fortress ruled by a dictator, but his army couldn't approach the fort all at once because there were landmines in the roads that would be triggered by such a large mass of people crossing over them. Instead he separated his army into small sections and went down many different roads in order to take over the fort. ","A fire broke out at a woodshed. People gathered to put it out, but it couldn't be extinguished by small buckets of water. The fire chief ordered everyone to stand in a circle with their buckets, so they could throw them together and put a large amount of water on the fire at once. It worked and everyone thought the fire chief was great. ",Good,They both dealt with using several small amounts of force to extinguish a larger force. ,Agree,,,,,,A number of lower intensity rays could be used together at the same time to destroy the tumor. ,A number of lower intensity rays could be used together at once to destroy the tumor. ,Male,,Non-Hispanic White or Euro-American,25 - 34,333,12/7/18 9:41,R_1od7Iv8TWhONNdM,,,,,,A small county was a ruled from strong fortress by a dictaror.  The fortress was situated in the middle of the country.,"As soon as he saw flames he sounded the alarm, and within minutes dozens of neightbours were on the sccene aremed with buckets.",Intermediate,This story is very simple.,Agree,There is a kind of ray that can be used to destroy the tumor.,This is very useful for us.,Male,,"Black, Afro-Caribbean, or African American",35 - 44,This survey is very easy.423,12/7/18 9:42,R_1OplIZJGoqu1tMn,,,,,,"A general was faced with a dilemma. A dictator had put many land mines that would go off if heavy voiceless went over them. To get rid of the dictator, he sent his troops through in small batches so they didn't detonate the mines. This was successful and they got rid of the dictator.","A fire broke out, it burned very quickly. The house was near a lake so there was a ready supply of water. They dropped lots of water on the house in one go to extinguish the fire. This plan worked and the people suggested the fire chief should get a wage increase for his efforts.",Intermediate,They both overcame a challenge that could have resulted in the loss of life. Once they succeeded in their respective challenges they were rewarded.,Moderately Agree,A ray with a higher intensity.,Using a high intensity laser ray.,Male,,Prefer not to answer,25 - 34,Everything was clear.581,12/7/18 9:42,R_1EXPTSYMXHkvsul,,,,,,"A small country was ruled from a strong fortress by a dictator. The fortress was situated in the middle of the country, surrounded by farms and villages. Many roads led to the fortress through the countryside. A rebel general vowed to capture the fortress. The general knew that an attack by his entire army would capture the fortress. He gathered his army at the head of one of the roads, ready to launch a full-scale direct attack. However, the general then learned that the dictator had planted mines on each of the roads. The mines were set so that small bodies of men could pass over them safely, since the dictator needed to move his troops and workers to and from the fortress. However, any large force would detonate the mines. Not only would this blow up the road, but it would also destroy many neighboring villages. It therefore seemed impossible to capture the fortress. However, the general devised a simple plan. He divided his army into small groups and dispatched each group to the head of a different road. When all was ready he gave the signal and each group marched down a different road. Each group continued down its road to the fortress so that the entire army arrived together at the fortress at the same time. In this way, the general captured the fortress and overthrew the dictator.","One night a fire broke out in a wood shed full of timber on Mr. Johnson潴s place. As soon as he saw flames he sounded the alarm, and within minutes dozens of neighbors were on the scene armed with buckets. The shed was already burning fiercely, and everyone was afraid that if it wasn潴t controlled quickly the house would go up next. Fortunately, the shed was right beside a lake, so there was plenty of water available. If a large volume of water could hit the fire at the same time, it would be extinguished. But with only small buckets to work with, it was hard to make any headway. The fire seemed to evaporate each bucket of water before it hit the wood. It looked like the house was doomed. Just then the fire chief arrived. He immediately took charge and organized everyone. He had everyone fill their bucket and then wait in a circle surrounding the burning shed. As soon as the last man was prepared, the chief gave a shout and everyone threw their bucket of water at the tire. The force of all the water together dampened the fire right down, and it was quickly brought under control, Mr. Johnson was relieved that his house was saved, and the village council voted the tire chief a raise in pay.",Intermediate,YES THE STORIES ARE SEEMS TO BE A LITTLE SIMILAR,Neutral,SOME WHAT LIKE A DE RADIATION PROCUDURE CAN BE DONE,YES THE SAME LIKE THE STORY,Male,,Other,18 - 24,NOTHING365,12/7/18 9:42,R_3soj0q5exUWzKPP,,,,,,"A small country was ruled from a strong fortress by a dictator. The fortress was situated in the middle of the country, surrounded by farms and villages. Many roads led to the fortress through the countryside. A rebel general vowed to capture the fortress. The general knew that an attack by his entire army would capture the fortress It therefore seemed impossible to capture the fortress. However, the general devised a simple plan. He divided his army into small groups and dispatched each group to the head of a different road. When all was ready he gave the signal and each group marched down a different road. Each group continued down its road to the fortress so that the entire army arrived together at the fortress at the same time. In this way, the general captured the fortress and overthrew the dictator.","One night a fire broke out in a wood shed full of timber on Mr. Johnson潴s place. As soon as he saw flames he sounded the alarm, and within minutes dozens of neighbors were on the scene armed with buckets The force of all the water together dampened the fire right down, and it was quickly brought under control, Mr. Johnson was relieved that his house was saved, and the village council voted the tire chief a raise in pay.",Good,"Describe as clearly as possible the ways in which the situations in the two stories seemed similar. One night a fire broke out in a wood shed full of timber on Mr. Johnson潴s place. As soon as he saw flames he sounded the alarm, and within minutes dozens of neighbors were on the scene armed with buckets.",Agree,Yes will be type of procedure might be used to destroy the tumor with the rays.,yes  procedure might be used to destroy avoid destroying the healthy tissue.,Male,,South Asian or Indian American,25 - 34,This is very good task.588,12/7/18 9:42,R_3oYEfjPOGs9YY9m,"The general wanted to capture a fortress.  Ther were many roads that led up to the fortress and the roads had mines on them that if set off would destroy the people and the neighboring villages.  However, small bodies of men could cross over the mines without setting them off.  Thus the general had his army split up into several smaller bodies and they marched up the fortress and overtook it.",There was a fire and it was a wood shed.  The Fire Chief had all of the people get buckets of water and surround the fire in a circle.  They all threw water on the fire at once and this put out the fire.  So many smaller people working together as a whole were able to put out the fire.,Good,They were similar in that it required groups of smaller individuals to surround something in order to accomplish one common goal.,Agree,,,,,,The doctor should set up may rays that circle the tumor such that each ray is of low intensity and won't damage the healthy tissue.  But collectively they will have enough force or intensity to destroy the tumor.,Set up many rays in a circle around the tumor.  Make sure the rays are of low intensity so that they won't harm the healthy tissue.  But collectively from the many angles they will combine to a high intensity to kill the tumor.,Female,,Non-Hispanic White or Euro-American,35 - 44,"You should extend the lenght of your timer on the HIT, many people will probably not be able to complete this in under 12 minutes."550,12/7/18 9:42,R_BAfAq2byllvqFgt,"syn: summary, brief, digest, synopsis are terms for a short version of a longer work. A summary is a brief statement or restatement of main points, esp. as a conclusion to a work: a summary of a chapter. A brief is a concise statement, usu. of the main points of a legal case: The attorney filed a brief.","Fire Department Management and the Union Need to Work TogetherPOSTMARKS  NOVEMBER 3, 2009""...Dear Editor, As a member of the American Fire Service and someone who loves the city of Austin, I have kept a close watch from a distance on the department and city, from the hiring of J.J. Adame through the current situation...""",Good,"A hallmark of effective writers is the ability to express the desired message in as few words as possible. Good writers, in other words, use language which is straightforward and to-the-point. Consider the following examples.(1) It is widely discussed by employees that many of them will be forced to change jobs and take on new responsibilities when the merger takes place between the two companies.(2) Before making a decision about whether the person on trial is guilty or innocent in this case, the members of the jury should be sure to carefully think about, ponder and reflect on all of the important and relevant testimony in the case.Notice how long-winded these sentences are, and how easily they could be shortened and simplified. An important part of revising and editing involves re-phrasing sentences to eliminate excessive wordiness. One way to reduce wordiness is to eliminate redundant words or phrases. Consider example one above. The phrases ""to change jobs"" and ""take on new responsibilities"" are redundant, and could be combined into one short phrase to be expressed more concisely.",Strongly Agree,,,,,,"For tumors that divide slowly, the mass may shrink over a long, extended period after radiation stops. The median time for a prostate cancer to shrink is about 18 months. For colon carcinomas, some may grow more quickly and others may grow more slowly.Apr 30, 2006","For tumors that divide slowly, the mass may shrink over a long, extended period after radiation stops. The median time for a prostate cancer to shrink is about 18 months. For colon carcinomas, some may grow more quickly and others may grow more slowly.Apr 30, 2006",Female,,South Asian or Indian American,25 - 34,"good,very nice"620,12/7/18 9:43,R_1mKHVJtCD6qzelT,,,,,,the small country ruled by dictator surrounded by farms and villages .general capture the fortress army ready to launch a full scale direct attack.large force would detonate the mines the general devised a simple plan .the divided army marched down a different road .finally the general capture the fortress and overthrew the dictador,"At night fire broke Mr. Johnson's place. Dozens of neighbors were on the scene, next large amount of water quantity could hit in the same time its would be extinguished finally the everyone fill the bascket and gave shot on the fire. Mr.johnson relived his house",Good,very dificult,Strongly Agree,block it,find for help,Female,,South Asian or Indian American,18 - 24,very gratefull629,12/7/18 9:43,R_2AYlkKE3iMw8t5M,,,,,,"There was a fortress that was going to be captured but it was surrounded by land mines.  The only issue was that the mines weren't detonated by small amounts of pressure, only by heavy objects.  The general who wanted to capture the fortress decided to send his troops split into small groups along the several different roads leading to the fortress to avoid detonation.  He arrived at the fortress with all his troops intact and was able to take control of the fortress.","A wood shed caught on fire and was going to burn down the house that was close by.  The people in the area attempted to take water from the lake in small buckets one by one and throw them out on the fire.  However, this amount of water was too small and it would just evaporate.  That's when the fire chief arrived.  he had everyone available grab a bucket of water from the lake and surround the fire and then all at once throw their water bucket onto the fire causing it to go down.  The fire then was controlled saving the nearby residence.",Intermediate,"The stories were similar in the fact that both solutions, the fire and defeating the fortress, required small amounts of people or water to gather at one location and commit to a single purpose at a given time to accomplish the goal.",Agree,"I'm not too certain the answer to this since it's impossible to operate on the patient per the text.  If I had to speculate, they would try to blast the area with several low impact rays focused on one area that would become a high intensity beam below the healthy tissue.  This might eradicate the tumor.","As in the previous comment, the would use several low intensity rays to get past the healthy tissue and focus them on gathering in the area of the tumor to eradicate it.",Male,,Non-Hispanic White or Euro-American,25 - 34,"Everything was clear in regards to the questions, there was a typo or two in the fire chief story where it referred to ""tire"" instead of ""fire""."442,12/7/18 9:43,R_1F2jOYIoP3HVeQv,"A general wanted to take a fort that was controlled by a dictator.  the dictator placed mines on the road that would kill any large force of men.  the general broke his army into two groups though, and on his word, marched down two different roads at the same time.","A mand shed was burning, and it was encroaching on the house.  The neighbors all came to help, and filled up buckets at the adjacent lake.  however, one at a time they weren't able to put out the fire.  The fire chief showed up though, and had them all fill up their buckets and wait in a circle around the shed.  On the chief's word, they all threw the water at once and it put out the fire.  the fire chief was then voted to get a raise.",Good,"they both utilized the principle that if a certain amount of force is needed, it may be needed all at once.",Agree,,,,,,"multiple rays from multiple places, so it doesn't attack healthy tissue with a great strength, but only hits the tumor.","I would attack with different rays from different places to avoid attacking healthy tissue, but instead focus the rays on the tumor.",Male,,Non-Hispanic White or Euro-American,25 - 34,483,12/7/18 9:43,R_1o20pu8k1HO5Lyk,fire to the johnson house,fire story,Good,yes,Agree,,,,,,good,yes,Male,,East Asian or Asian American,25 - 34,good320,12/7/18 9:44,R_1g1Ggmi1YHcU00e,the general want to capture the fortress. but mines are placed around the fortress. so he decided to dispatch those troops to small groups to march the fortress. then he capture the dictator and the fortress safely.,the fire chief story is the best story of all. because there is more moral logics and ethics are placed,Good,good study at all on those stories,Strongly Agree,,,,,,radiation must be stopped before it will be a worst pollution,kindly stop the radiation problem,Male,,South Asian or Indian American,25 - 34,good study639,12/7/18 9:44,R_2PkaGbfTrqMWslS,,,,,,"A small country was ruled from a strong fortress by a dictator.The fortress was situated in the middle of the country, surrounded by farms and villages.A rebel general vowed to capture the fortress. The general knew that an attack by his entire army would capture the fortress.The mines were set so that small bodies of men could pass over them safely, since the dictator needed to move his troops and workers to and from the fortress. However, any large force would detonate the mines. Not only would this blow up the road, but it would also destroy many neighboring villages. It therefore seemed impossible to capture the fortress. However, the general devised a simple plan. He divided his army into small groups and dispatched each group to the head of a different road. When all was ready he gave the signal and group marched down adifferent road. Each group continued down its road to the fortress so that the entire army arrived together at the fortress at the same time. In this way, the general captured the fortress and overthrew the dictator.","One night a fire broke out in a wood shed full of timber on Mr. Johnson潴s place.As soon as he saw flames he sounded the alarm, and within minutes dozens of neighbors were on the scene armed with buckets. The shed was already burning fiercely, and everyone was afraid that if it wasn潴t controlled quickly the house would go up next. Fortunately, the shed was right beside a lake, so there was plenty of water available. If a large volume of water could hit the fire at the same time, it would be extinguished. But with only small buckets to work with, it was hard to make any headway. The fire seemed to evaporate each bucket of water before it hit the wood. It looked like the house was doomed. Just then the fire chief arrived. He immediately took charge and organized everyone. He had everyone fill their bucket and then wait in a circle surrounding the burning shed. As soon as the last man was prepared, the chief gave a shout and everyone threw their bucket of water at the tire. The force of all the water together dampened the fire right down, and it was quickly brought under control, Mr. Johnson was relieved that his house was saved, and the village council voted the tire chief raise in pay.",Good,its two are interesting,Neutral,take preventions,take preventions,Female,,East Asian or Asian American,25 - 34,good483,12/7/18 9:45,R_1Ecbfh4Rqtg6eOT,A general needs to attack a dictator in a fortress but all the roads leading to it are mined.  The mines are only tripped by large forces so the general wisely divides his army into many smaller ones to travel the roads and arrive at the fortress at the same time to attack.,A wood shed full of timber broke out in fire one night.  The people tried throwing buckets of water but the fire was too strong.  A fire chief arrived and had everyone fill their buckets and throw them at once so as to overwhelm the fire.,Good,They both involve the combining of a force from many directions to overwhelm an obstacle.,Agree,,,,,,I would use many low power rays fro different directions that pass harmlessly through normal tissue that converge at the tumor and are then strong enough to destroy it.,I would use many low power rays fro different directions that pass harmlessly through normal tissue that converge at the tumor and are then strong enough to destroy it.,Male,,Non-Hispanic White or Euro-American,55 - 64,no issues849,12/7/18 9:45,R_239TdGJRdOjNp6T," The general knew that an attack by his entire army would capture the fortress. He gathered his army at the head of one of the roads, ready to launch a full-scale direct attack.  since the dictator needed to move his troops and workers to and from the fortress. However, any large force would detonate the mines. Not only would this blow up the road, but it would also destroy many neighboring villages. When all was ready he gave the signal and each group marched down a different road. Each group continued down its road to the fortress so that the entire army arrived together at the fortress at the same time. In this way, the general captured the fortress and overthrew the dictator.","One night a fire broke out in a wood shed full of timber on Mr. Johnson潴s place. As soon as he saw flames he sounded the alarm, and within minutes dozens of neighbors were on the scene armed with buckets.  The fire seemed to evaporate each bucket of water before it hit the wood. It looked like the house was doomed. Just then the fire chief arrived. He immediately took charge and organized everyone. The force of all the water together dampened the fire right down, and it was quickly brought under control, Mr. Johnson was relieved that his house was saved, and the village council voted the tire chief a raise in pay.",Good,THE GENERAL STORY WAS VERY GOOD. BECAUSE IT WAS VERY EMOTIONAL ONE.HE THINGS SAVE THEIR FRIENDS FOR HIS NATION.HE DID ALL WORK FOR US.,Neutral,,,,,,WE CAN CURE TUMOR WITH RAYS.BECAUSE RAYS KILLS UNWANTED SELES IN OUR BODY.WE CAN TAKE LOTS OF CARE ABOUT OUR BODY.,IT WAS A SAME PROCEDURE.BECAUSE TUMOR AND ENEMIES ARE SAME . WE KILL TUMOR USING RAYS AND WE CAN KILL ENEMIES USING WEAPONS.,Female,,East Asian or Asian American,25 - 34,GOOD692,12/7/18 9:45,R_3PtLb8f7kO2pJZB,,,,,,"summary, brief, digest, synopsis are terms for a short version of a longer work. A summary is a brief statement or restatement of main points, esp. as a conclusion to a work: a summary of a chapter. A brief is a concise statement, usu. of the main points of a legal case: The attorney filed a brief.","Coordinates various projects requiring organization of staff such as specialized training, vehicle and equipment maintenance, hose testing, pumper testing, hydrant maintenance and uniform and PPE purchases.",Intermediate,"some  different",Agree," the mass may shrink over a long, extended period after radiation stops. The median time for a prostate cancer to shrink is about 18 months. For colon carcinomas, some may grow more quickly and others may grow more slowly.Apr 30, 2006","oncologists use this type of treatment to destroy cancer cells and slow tumor growth without harming nearby healthy tissue. ... When it is not possible to destroy all of the cancer, doctors may use radiation therapy to shrink tumors and relieve symptoms. This is called palliative radiation therapy.",Female,,South Asian or Indian American,25 - 34,"Increasingly, in order to scout out the top talent, businesses are now throwing curveball questions during the interview process. Asking about seemingly unrelated topics can help give a company a wider snapshot into the person and their life. "602,12/7/18 9:46,R_560B60jFRRguUKJ,john is a man living in a village. one day the fired in the woodern materials so he pour the water. surprisingly the lake is near to his house.,johnson' s house was fired. so the chief gives the idea to waterise in the fire,Intermediate,two stories are about fire,Agree,,,,,,doctor gives the first aid,because of radiation problem many peoples are affected,Male,,Middle Eastern or Arab American,25 - 34,